{
  "version": 2,
  "id": "introducing-committer-follows-renames",
  "target": "urn:change-saga:changesaga-codebase:fragment:trust-boundaries:landmark:trust-follow-edge",
  "kind": "behavior",
  "statement": "Tracked review records are attributed to the committer that introduced the path, following renames instead of trusting payload identity.",
  "evidence": [
    "saga-diff://v1/line?base=14afd0526c471d9ccad5825fadda735094e599e4\u0026end=268\u0026head=product-964a0b07e1a68460c0d665e55100f062a506f951b593593984d44517f040f9bb\u0026path=internal%2Fgitattribution%2Fgitattribution.go\u0026repository=https%3A%2F%2Fgithub.com%2Ftwentyideas%2Fchange-saga.git\u0026side=new\u0026start=204"
  ],
  "created_at": "2026-08-22T04:24:49.767608Z"
}
